Id,FullName,Phone,Email,Subject,Content,AddDate
14,elnur,mr.elnurmustafayev@mail.ru,mr.elnurmustafayev@mail.ru,l want to buy car,car,2022-01-19 22:28:55.4748652
20,Eliyev ramik,0509950091,0509950091,Masin,Masin axtarram,2022-02-16 19:28:22.8990890
21,Memmed hesenov,0513492906,0513492906,Masin almaq isteyirem,Salam.Men bu herraclarda istirak etmek isteyirem.Bu barede nece komek olursunuz?,2022-03-13 18:29:21.4663696
22,Memmed hesenov,0513492906,0513492906,Masin almaq isteyirem,Salam.Men bu herraclarda istirak etmek isteyirem.Bu barede nece komek olursunuz?,2022-03-13 18:31:29.4416557
23,Elçin Alıyev,+994554840050       elcin.aliyevh@gmail.com,+994554840050       elcin.aliyevh@gmail.com,Alqi satqi,Salam Aleykum mən hərracda pul təklif edib sifaris etmek isdedim alinmadi (,2022-04-10 01:25:46.8104251
24,Elçin Alıyev,+994554840050       elcin.aliyevh@gmail.com,+994554840050       elcin.aliyevh@gmail.com,Alqi satqi,Salam Aleykum mən hərracda pul təklif edib sifaris etmek isdedim alinmadi (,2022-04-10 01:25:54.8256124
